[
  {"evidence_id":"gf-001","text":"The setup guide was clear and I was running in ten minutes.","source_type":"product_review","source_name":"Marketplace reviews","created_at":"2026-08-01T09:00:00Z","language":"en","market":"US","metadata":{"engagement_count":7}},
  {"evidence_id":"gf-002","text":"Can I export invoices as PDF for our finance team?","source_type":"customer_inquiry","source_name":"Support inbox","created_at":"2026-08-02T10:30:00Z","language":"en","region":"Europe","metadata":{}},
  {"evidence_id":"gf-003","text":"We need single sign-on before security will approve a rollout.","source_type":"crm_note","source_name":"Enterprise CRM","created_at":"2026-08-03T14:20:00Z","language":"en","market":"UK","metadata":{"account_segment":"enterprise"}},
  {"evidence_id":"gf-004","text":"The monthly price is too high for a three-person team.","source_type":"survey_response","source_name":"Trial exit survey","created_at":"2026-08-04T08:15:00Z","language":"en","market":"CA","metadata":{}},
  {"evidence_id":"gf-005","text":"I love how quickly the dashboard loads on my phone.","source_type":"social_feedback","source_name":"Community forum","created_at":"2026-08-05T17:45:00Z","language":"en","market":"AU","metadata":{"engagement_count":12}},
  {"evidence_id":"gf-006","text":"Our team is worried about where customer data is stored.","source_type":"interview_note","source_name":"Buyer interview","created_at":"2026-08-06T11:00:00Z","language":"en","region":"EU","metadata":{}},
  {"evidence_id":"gf-007","text":"Compared with our spreadsheet, this saves hours every Friday.","source_type":"product_review","source_name":"Customer review","created_at":"2026-08-07T12:00:00Z","language":"en","market":"US","metadata":{"engagement_count":4}},
  {"evidence_id":"gf-008","text":"The verification email never arrived and support has not replied.","source_type":"customer_inquiry","source_name":"Support inbox","created_at":"2026-08-08T09:40:00Z","language":"en","market":"SG","metadata":{}},
  {"evidence_id":"gf-009","text":"I use the mobile view while checking inventory on the warehouse floor.","source_type":"interview_note","source_name":"Operations interview","created_at":"2026-08-09T15:10:00Z","language":"en","market":"US","metadata":{}},
  {"evidence_id":"gf-010","text":"Please add a way to assign one task to two owners.","source_type":"social_feedback","source_name":"Ideas board","created_at":"2026-08-10T13:25:00Z","language":"en","metadata":{"engagement_count":18}},
  {"evidence_id":"gf-011","text":"Does the service integrate with our existing identity provider?","source_type":"sales_note","source_name":"Discovery call","created_at":"2026-08-11T16:00:00Z","language":"en","market":"DE","metadata":{}},
  {"evidence_id":"gf-012","text":"The import failed twice and the error message did not explain what to fix.","source_type":"survey_response","source_name":"Onboarding survey","created_at":"2026-08-12T07:50:00Z","language":"en","market":"IN","metadata":{}},
  {"evidence_id":"gf-013","text":"We are considering switching, but migration effort is the main concern.","source_type":"crm_note","source_name":"Opportunity notes","created_at":"2026-08-13T18:10:00Z","language":"en","market":"US","metadata":{"account_segment":"mid-market"}},
  {"evidence_id":"gf-014","text":"A colleague recommended it and the audit history makes the process feel trustworthy.","source_type":"interview_note","source_name":"User interview","created_at":"2026-08-14T10:05:00Z","language":"en","market":"JP","metadata":{}},
  {"evidence_id":"gf-015","text":"I cancelled after billing continued during the paused period.","source_type":"product_review","source_name":"Cancellation feedback","created_at":"2026-08-15T19:30:00Z","language":"en","market":"US","metadata":{}}
]
